{
    "workflow_version":  "2.0.0",
    "status":  "draft",
    "article":  {
                    "article_url":  "https://onedaytrading.net/game-news/df0903bb-10aa-470a-8cd5-59b9dbf39a31",
                    "canonical_url":  "https://onedaytrading.net/game-news/df0903bb-10aa-470a-8cd5-59b9dbf39a31",
                    "article_id":  "df0903bb-10aa-470a-8cd5-59b9dbf39a31",
                    "title":  "파크라이 TV화에 스티브 부시미 합류, 유비소프트가 노리는 건 \u0027폴아웃 효과\u0027",
                    "description":  "유비소프트 파크라이 드라마에 스티브 부시미 캐스팅 확정, 실적 부진 속 게임 IP를 드라마·영화로 재활용해 백카탈로그 매출을 되살리는 업계 전략의 연장선이다. 관련 종목 유비소프트, 게임 섹터의 호재·악재 영향과 투자 포인트를 원데이트레이딩이 정리합니다.",
                    "body":  "파크라이 TV화에 스티브 부시미 합류, 유비소프트가 노리는 건 \u0027폴아웃 효과\u0027 | 원데이트레이딩 본문으로 바로가기 메뉴 바로가기 oneday trading 경제 크립토 부동산 IT 모빌리티 바이오 산업 게임 엔터 oneday trading 뉴스 경제 크립토 부동산 IT 모빌리티 바이오 산업 게임 엔터 바로가기 홈 실시간 시세 경제 캘린더 배당 캘린더 공모주 일정 인사이트 커뮤니티 매거진 AI PRO 이 사이트가 도움이 됐다면 후원 © 2026 OnedayTrading ⌘K KO 로그인 회원가입 관련 태그 2 게임 # 유비소프트 공유 파크라이 TV화에 스티브 부시미 합류, 유비소프트가 노리는 건 \u0027폴아웃 효과\u0027 윤재호 반도체·IT 담당 편집위원 편집팀 PC Gamer · 2026년 7월 15일 · 8 AI 가격예측 유비소프트 일봉 주봉 통계적 참고 정보 · 수익 보장 아님 정밀 분석 AD 한눈에 유비소프트의 대표 프랜차이즈 파크라이가 TV 시리즈로 제작되는 가운데 배우 스티브 부시미의 합류가 확정됐다. 그가 기묘하지만 우호적인 조력자를 연기할지, 매력적인 빌런을 맡을지는 아직 공개되지 않았다. 캐스팅 하나로 끝날 뉴스가 아닌 이유는, 이 프로젝트가 유비소프트 실적 부진 국면에서 게임 IP를 영상 콘텐츠로 전환해 매출원을 늘리는 업계 전체 전략의 한 사례이기 때문이다. 왜 지금 중요한가 게임 IP의 단계를 나눠보면 개발-퍼블리싱-라이선싱-영상화의 순서로 수익이 쌓인다. 신작 게임 개발은 수년의 시간과 수천억 원대 제작비가 들지만, 이미 확보된 IP를 드라마·영화 판권으로 라이선스하면 유비소프트 입장에서는 추가 개발비 없이 라이선스 수익과 브랜드 노출을 동시에 얻는다. 이 구조가 실제로 작동한 선례가 폴아웃이다. 아마존 폴아웃 시리즈 방영 직후 출시된 지 8년 넘은 폴아웃4의 스팀 동시접속자가 역대 최고치로 튀어올랐고, 이는 신작 없이도 백카탈로그 매출을 끌어올릴 수 있음을 보여줬다. 라스트오브어스의 HBO 드라마화 역시 비슷한 경로로 리메이크판 판매를 자극한 바 있다. 유비소프트는 최근 몇 년간 어쌔신크리드 섀도우 출시 지연과 스타워즈 아웃로 흥행 부진으로 주가가 다년 최저 수준까지 밀렸고, 이 과정에서 어쌔신크리드·파크라이·레인보우식스 등 핵심 IP를 별도 자회사로 분리해 외부 자본을 유치하는 구조조정을 단행했다. 파크라이 드라마화는 이 IP 자회사가 신작 판매에만 의존하지 않고 영상화라는 별도 현금흐름을 만들어낼 수 있는지를 가늠하는 시험대다. 신작 사이클이 늦어지는 해일수록 이런 부가 수익원의 비중이 커진다. 자주 묻는 질문 스티브 부시미 배역이 왜 화제인가 — 조력자 NPC와 빌런 사이에서 어느 쪽이든 흥행에 유리한 캐릭터성을 지닌 배우라 캐스팅 자체가 마케팅 소재가 된다. 드라마화가 실제 게임 매출로 이어지나 — 폴아웃 사례처럼 방영 직후 구작 동시접속자·판매량이 반짝 상승하는 경향이 있으나, 이는 일시적 트래픽이며 신작 매출을 대체하지는 못한다. 유비소프트 실적에 언제 반영되나 — 드라마 방영 시점과 겹치는 분기 실적에서 파크라이 시리즈 판매량·플레이어 지표 변화로 먼저 확인 가능하다. 이 뉴스가 게임업계 전체에 주는 신호는 — 신작 개발 리스크가 커진 시기일수록 대형 퍼블리셔들이 IP 영상화로 리스크를 분산하는 흐름이 강해진다는 방증이다. 관련 종목·섹터 영향 유비소프트 — 파크라이 IP 원천 보유사로, 드라마 흥행 시 라이선스 수익과 백카탈로그 판매 반등을 동시에 기대할 수 있는 직접 수혜 구조다. 글로벌 스트리밍 플랫폼 — 파크라이 시리즈를 유통할 채널은 신규 오리지널 IP 확보 경쟁에서 게임 IP 의존도가 커지는 흐름의 연장선에 있다. 게임 IP 영상화 사례가 많은 경쟁 퍼블리셔들 — 폴아웃(베데스다), 라스트오브어스(소니) 등 유사 전략을 쓰는 회사들이 함께 재조명받을 수 있다. 게임 이식·리마스터 개발 스튜디오 — 드라마 흥행이 확인되면 원작 게임의 리마스터·확장판 수요가 뒤따르는 패턴이 반복될 가능성이 있다. ⚡ 30초 브리핑 5분 읽기 유비소프트 파크라이 드라마에 스티브 부시미 캐스팅 확정, 실적 부진 속 게임 IP를 드라마·영화로 재활용해 백카탈로그 매출을 되살리는 업계 전략의 연장선이다. AD 투자 시 유의점 캐스팅 발표는 제작 초기 단계 뉴스로, 방영 일정과 흥행 여부라는 두 개의 불확실성이 아직 남아 있다. 백카탈로그 판매 반등은 통상 단기 스파이크에 그치므로 신작 매출과 혼동해 밸류에이션에 반영하는 것은 과잉 해석이다. 유비소프트의 IP 자회사 분리 이후 지분 구조 변화가 파크라이 영상화 수익의 실제 귀속 비율에 영향을 줄 수 있어 확인이 필요하다. 확인 지표는 드라마 공개 일정, 방영 직후 파크라이 시리즈 플레이어 지표, 유비소프트 다음 분기 실적 발표다. 종합 전망 낙관적으로 보면 파크라이 드라마가 폴아웃급 반향을 일으킬 경우 유비소프트는 신작 지연 국면에서도 현금흐름을 방어할 카드를 하나 더 갖게 된다. 다만 게임 원작 영상화는 실패 사례도 적지 않아 흥행이 보장된 경로가 아니며, 유비소프트 자체의 근본 문제인 신작 개발 지연과 조직 개편이 해소되지 않는 한 드라마 하나로 펀더멘털이 바뀌지는 않는다. 다음 확인 지점은 방영 일정 공식화와 첫 예고편 공개 이후 나타날 파크라이 프랜차이즈 판매 지표다. 🎮 분석 데이터 분야 게임 투자 관점 호재 유비소프트의 핵심 IP 파크라이가 드라마화되고 유명 배우가 합류한 것은 게임사가 신작 개발비 없이 IP 인지도를 확장하고 백카탈로그 판매를 재점화하는 수익 다각화 경로에 해당해 주가에 긍정적으로 해석할 수 있다. 관련 종목 #유비소프트 본 글은 원문 게임 뉴스를 바탕으로 자동 요약·분석된 콘텐츠입니다. 원문 보기 (PC Gamer) 원문 보기 📝 원데이트레이딩 편집 기준 작성 방식 공개 뉴스·공시를 기반으로 AI가 초안을 요약하고, 편집팀이 사실관계와 종목 연결을 검수합니다. 분석 기준 관련 종목·섹터·실적 영향·단기 주가 변수를 중심으로 투자자 관점에서 정리합니다. 데이터 출처 시세·외국인/기관 수급 데이터는 한국투자증권(KIS)에서 제공합니다. 투자 유의 본 콘텐츠는 투자 참고용이며, 특정 종목의 매매를 권유하지 않습니다. 정정·삭제 요청 devoh@signpost.kr 이 뉴스, 호재일까 악재일까? 한 번의 클릭으로 다른 투자자들과 판단을 비교해보세요. 📈 호재 📉 악재 🧩 관련 종목 기사 분석 기반 대장주·관련주 게임 섹터 › 이 기사 대장주 유비 ⭐ 유비소프트 UBSFY 뉴스 → 대장주·관련주는 기사 분석 및 시세 데이터 기반 자동 도출이며 투자 권유가 아닙니다. 관련 게임뉴스 스톱 킬링 게임즈 규제 무산 — 라이브서비스 게임사가 한숨 돌린 이유 에이도스 몬트리올 창업자 직격 — 게임 경영진은 열정 아닌 엑셀로 움직인다 어쌔신 크리드 유비소프트 공동창업자 클로드 기요모 별세, 지배구조 흔들리나 유비소프트 공동창업자 클로드 기유모 비행기 사고 사망과 지배구조 변수 어쌔신 크리드 블랙 플래그 리싱크, 신규 콘텐츠 공개의 의미 어쌔신 크리드 창시자의 15년 집념작 1666: 암스테르담, 마침내 베일을 벗다 목록으로 경제뉴스 크립토뉴스 부동산뉴스 IT뉴스 모빌리티뉴스 바이오뉴스 산업뉴스 게임뉴스 엔터뉴스 인사이트 매거진 이용약관 개인정보처리방침 운영정책 청소년보호 투자 고지 | 공지사항 FAQ 문의 신고 | 서비스 소개 팀 소개 편집팀 편집정책 사업자등록번호: 753-18-02714 | 대표: 오한빈 | devoh@signpost.kr Tip © 2026 OneDayTrading. All rights reserved. 일부 콘텐츠는 CC BY-NC-SA 4.0 라이선스에 따라 이용할 수 있습니다. 본 사이트는 투자 권유나 특정 종목 추천을 목적으로 하지 않으며, 모든 투자 결정은 이용자 본인의 판단과 책임 하에 이루어져야 합니다. 게시된 정보의 정확성, 완전성, 적시성에 대해 보증하지 않으며, 이로 인해 발생한 손실에 대해 책임지지 않습니다. oneday . TRADING 홈 실시간 시세 경제 캘린더 배당 캘린더 공모주 일정 AI PRO 뉴스 경제 증시·환율·금리 크립토 비트코인·ETF 부동산 아파트·정책 IT AI·반도체·빅테크 모빌리티 전기차·배터리 바이오 임상·신약 산업 에너지·방산·조선 게임 신작·e스포츠 엔터 K팝·콘텐츠 인사이트 커뮤니티 매거진 시장 심리 최근 100 건 – /100 집계 중 호재 – 악재 – 데일리 인사이트 받아보기 매일 아침 시장을 여는 핵심 뉴스와 인사이트를 보내드립니다. 구독하기 ♥ 이 사이트가 도움이 됐다면 커피 한 잔으로 응원해 주세요 커피 한 잔 사주기 © 2026 OnedayTrading All rights reserved.",
                    "category":  "게임뉴스",
                    "market_label":  "해외주식",
                    "source_name":  "",
                    "published_at":  "2026-07-14T23:18:36.125Z",
                    "og_image":  "https://onedaytrading.net/i/news/cards/ac36e926a4096026.jpg"
                },
    "visual":  {
                   "strategy":  "manual_background",
                   "subject":  "",
                   "background_path":  "C:\\work\\assets\\backgrounds\\far-cry-steve-buscemi.png",
                   "source_url":  "https://onedaytrading.net/i/news/cards/ac36e926a4096026.jpg",
                   "license":  "review_required"
               },
    "evidence":  [

                 ],
    "pages":  {
                  "page1":  {
                                "breaking_label":  "긴급속보",
                                "headline":  "파크라이 TV화에 스티브 부시미 합류, 유비소프트가 노리는 건 \u0027폴아웃 효과\u0027",
                                "subtitle":  "유비소프트 파크라이 드라마에 스티브 부시미 캐스팅 확정, 실적 부진 속 게임 IP를 드라마·영화로 재활용해 백카탈로그 매출을 되살리는 업계 전략의 연장선이다. 관련 종목 유비소프트, 게임 섹터의 호재·악재 영향과 투자 포인트를 원데이트레이딩이 정리합니다.",
                                "cta":  "핵심 분석 보기 →"
                            },
                  "page2":  {
                                "analysis_headline":  "이 뉴스가 시장에 중요한 이유는?",
                                "quick_answer":  "유비소프트 파크라이 드라마에 스티브 부시미 캐스팅 확정, 실적 부진 속 게임 IP를 드라마·영화로 재활용해 백카탈로그 매출을 되살리는 업계 전략의 연장선이다. 관련 종목 유비소프트, 게임 섹터의 호재·악재 영향과 투자 포인트를 원데이트레이딩이 정리합니다.",
                                "paragraphs":  [
                                                   "유비소프트 파크라이 드라마에 스티브 부시미 캐스팅 확정, 실적 부진 속 게임 IP를 드라마·영화로 재활용해 백카탈로그 매출을 되살리는 업계 전략의 연장선이다. 관련 종목 유비소프트, 게임 섹터의 호재·악재 영향과 투자 포인트를 원데이트레이딩이 정리합니다.",
                                                   "영향 경로와 미확인 변수는 추가 분석이 필요합니다.",
                                                   "후속 데이터가 확인되면 평가가 달라질 수 있습니다."
                                               ],
                                "memory_line":  "핵심 변수는 후속 데이터에서 확인됩니다."
                            },
                  "page3":  {
                                "evaluation":  "중립",
                                "evaluation_headline":  "현재 평가는\n\u0027중립\u0027",
                                "evaluation_summary":  "원문 사실은 확인됐지만 시장 영향은 추가 근거가 필요합니다.",
                                "expect":  "기사의 직접 효과",
                                "verify":  "공개되지 않은 조건",
                                "judge":  "후속 수치와 일정",
                                "paragraphs":  [
                                                   "확인된 사실을 중심으로 봅니다.",
                                                   "공개되지 않은 조건은 단정하지 않습니다.",
                                                   "후속 수치가 평가를 바꿀 기준입니다."
                                               ],
                                "memory_line":  "최종 판단은 후속 데이터가 말해줍니다."
                            },
                  "page4":  {
                                "instagram_handle":  "@onedaytrading.io",
                                "website":  "onedaytrading.net"
                            }
              },
    "qa":  {
               "approved":  false,
               "warnings":  [
                                "AI/편집 검수 필요",
                                "이미지 권리 검수 필요"
                            ]
           }
}
