{
  "workflow_version": "2.0.0",
  "status": "ready",
  "article": {
    "article_url": "https://onedaytrading.net/example/article-id",
    "canonical_url": "https://onedaytrading.net/example/article-id",
    "article_id": "article-id",
    "title": "기사 원문 제목",
    "description": "기사 원문 설명",
    "body": "기사 원문 본문",
    "category": "게임",
    "market_label": "해외주식",
    "source_name": "원문 출처",
    "published_at": "2026-01-01T00:00:00Z",
    "og_image": "https://example.com/image.jpg"
  },
  "visual": {
    "strategy": "reference_recompose",
    "subject": "기사 핵심 인물 또는 대상",
    "background_path": "assets/backgrounds/example.png",
    "source_url": "https://example.com/image.jpg",
    "license": "review_required"
  },
  "evidence": [],
  "pages": {
    "page1": {
      "breaking_label": "긴급속보",
      "headline": "기사형 제목 최대 2줄",
      "subtitle": "왜 중요한지 설명하는 서브타이틀",
      "cta": "핵심 분석 보기 →"
    },
    "page2": {
      "analysis_headline": "독자 질문 최대 2줄",
      "quick_answer": "질문에 대한 잠정 답",
      "paragraphs": ["확인된 사실과 효과", "영향 경로와 미확인 변수", "확장 및 실패 가능성"],
      "memory_line": "기억할 판단 기준"
    },
    "page3": {
      "evaluation": "제한적 호재",
      "evaluation_headline": "지금 평가는\n'제한적 호재'",
      "evaluation_summary": "현재 평가의 근거",
      "expect": "기대할 것",
      "verify": "확인할 것",
      "judge": "판단할 것",
      "paragraphs": ["긍정 근거", "아직 부족한 정보", "평가를 바꿀 데이터"],
      "memory_line": "최종 평가 한 줄"
    },
    "page4": {
      "instagram_handle": "@onedaytrading.io",
      "website": "onedaytrading.net"
    }
  },
  "qa": {
    "approved": false,
    "warnings": []
  }
}
