{
    "workflow_version":  "2.0.0",
    "status":  "needs_image",
    "article":  {
                    "article_url":  "https://onedaytrading.net/economy-news/b58a8b78-8d27-48a4-9bfc-4c38d8db94d0",
                    "canonical_url":  "https://onedaytrading.net/economy-news/b58a8b78-8d27-48a4-9bfc-4c38d8db94d0",
                    "article_id":  "b58a8b78-8d27-48a4-9bfc-4c38d8db94d0",
                    "title":  "엔비디아 H200 중국 출하 시작, 최상위 AI칩까지 넘은 수출 규제선",
                    "description":  "엔비디아의 최상위 AI 반도체 H200이 미국 정부 고위 관계자의 의회 확인 속에 중국向 출하를 시작하며 주가가 장중 4% 급등했다. SK하이닉스의 HBM3e 공급과 국내 반도체 장비주까지 수급 기대감이 번지는 모습이다.",
                    "body":  "엔비디아 H200 중국 출하 시작, 최상위 AI칩까지 넘은 수출 규제선 | 원데이트레이딩 본문으로 바로가기 메뉴 바로가기 oneday trading 경제 크립토 부동산 IT 모빌리티 바이오 산업 게임 엔터 oneday trading 뉴스 경제 크립토 부동산 IT 모빌리티 바이오 산업 게임 엔터 바로가기 홈 실시간 시세 경제 캘린더 배당 캘린더 공모주 일정 인사이트 커뮤니티 매거진 AI PRO 이 사이트가 도움이 됐다면 후원 © 2026 OnedayTrading ⌘K KO 로그인 회원가입 관련 태그 5 반도체 # 엔비디아 # SK하이닉스 # 한미반도체 # 삼성전자 공유 엔비디아 H200 중국 출하 시작, 최상위 AI칩까지 넘은 수출 규제선 윤재호 반도체·IT 담당 편집위원 편집팀 연합뉴스 증권 · 2026년 7월 15일 · 3 EN AI 가격예측 SK하이닉스 일봉 주봉 통계적 참고 정보 · 수익 보장 아님 정밀 분석 AD 3줄 브리핑 미국 정부 고위 관계자가 14일(현지시간) 의회에서 엔비디아의 최상위 AI 칩 H200의 중국向 출하가 이미 시작됐다고 확인했다 이 소식에 엔비디아 주가는 장중 4% 뛰었다 H200은 그동안 대중 수출 통제선 위에 있던 고성능 칩이라는 점에서, 시장은 이번 출하를 규제 완화 국면의 실질적 증거로 받아들이는 분위기다 무엇이 달라지나 지금까지 엔비디아가 중국에 합법적으로 팔 수 있었던 것은 성능을 깎아 만든 하위 사양 칩이었다. H100이나 A100 같은 고성능 제품은 애초에 수출 자체가 막혀 있었고, 그 자리를 메운 게 연산 성능과 메모리 대역폭을 낮춘 대체 모델이었다. H200은 이 대체 모델보다 상위에 있는 칩이다. 이런 칩의 출하가 확인됐다는 것은 단순히 중국에 물건을 하나 더 판다는 뜻이 아니라, 그동안 엔비디아 데이터센터 사업부에서 사실상 비어 있던 중국 매출 칸이 다시 채워지기 시작했다는 신호로 읽어야 한다. 투자자가 봐야 할 지점은 두 갈래다. 첫째는 물량이다. 하위 사양 칩만 팔던 구간에서 상위 사양 칩 판매가 재개되면 평균판매단가가 올라가고, 이는 곧 매출총이익률 개선으로 이어진다. 둘째는 지속성이다. 수출 통제는 행정부의 정책 판단에 따라 몇 달 단위로 뒤집힌 전례가 있다. 오늘의 4% 급등이 구조적 매출 정상화를 반영한 것인지, 아니면 다시 막힐 수 있는 일시적 완화에 대한 기대감인지는 다음 분기 실적에서 중국향 매출 비중이 실제로 얼마나 늘었는지를 봐야 갈린다. 숫자와 맥락으로 보기 주가 4% 상승은 엔비디아 시가총액 기준으로 결코 작은 숫자가 아니다. 다만 이 반응이 실제 주문량 확인이 아니라 고위 관계자의 의회 발언이라는 정책 신호 하나에서 나왔다는 점은 짚어야 한다. H200은 HBM3e 메모리를 탑재해 이전 세대 대비 메모리 용량과 대역폭을 늘린 모델로, 대규모 추론 작업에서 강점을 갖는 칩으로 알려져 있다. 중국 클라우드·인터넷 기업들의 수요 축이 학습에서 추론 쪽으로 옮겨가는 시점과 맞물린다는 점에서, 이번 출하 재개가 겨냥하는 수요처가 어디인지도 함께 봐야 할 대목이다. 수혜·피해 종목 엔비디아: 중국向 데이터센터 GPU 매출 재개로 매출 공백이 메워지고, 하위 사양 대체 모델 대비 평균판매단가 상승 효과가 기대된다 SK하이닉스: H200에 탑재되는 HBM3e의 핵심 공급사로, 중국向 물량 확대 시 HBM 출하량 증가로 직결된다 한미반도체: HBM 후공정 본딩 장비를 공급하는 만큼 HBM 수요 확대 국면에서 장비 발주 확대 수혜가 예상된다 삼성전자: HBM3e 공급 경쟁에 참여하고 있어 물량 배분 확대 시 반사이익을 볼 수 있으나, 엔비디아向 공급 비중은 SK하이닉스 대비 아직 낮은 편이다 중국 자체 AI 반도체 진영: 화웨이 어센드 등 대체재 육성 속도가 상대적으로 늦춰질 수 있어 국내 반도체 소부장 업체 입장에서는 경쟁 구도 부담이 줄어드는 효과가 있다 ⚡ 30초 브리핑 4분 읽기 엔비디아의 최상위 AI 반도체 H200이 미국 정부 고위 관계자의 의회 확인 속에 중국向 출하를 시작하며 주가가 장중 4% 급등했다. SK하이닉스의 HBM3e 공급과 국내 반도체 장비주까지 수급 기대감이 번지는 모습이다. AD 리스크 체크 수출 통제는 행정부 판단과 의회 협상에 따라 다시 강화될 수 있는 정책 변수로, 되돌림 가능성이 상존한다 중국 정부가 자국 기업들에 자국산 칩 사용을 유도해 온 만큼, 실제 구매 물량이 기대만큼 늘지 않을 가능성이 있다 오늘 급등은 정책 발언 하나에 기댄 반응으로, 다음 분기 실적에서 중국향 매출이 숫자로 확인되기 전까지는 기대감 성격이 짙다 H200은 이미 차세대 블랙웰 계열로 세대 교체가 진행 중인 제품이라, 중국向 물량이 늘어도 전체 실적에서 차지하는 비중은 제한적일 수 있다 한 줄 결론 H200의 중국 출하는 엔비디아 데이터센터 매출의 공백 하나를 메우는 실질적 신호지만, 정책 변수가 여전히 살아있는 만큼 다음 분기 중국향 매출 비중과 수출 통제 후속 발표를 함께 확인한 뒤에 판단해도 늦지 않다 📊 분석 데이터 시장 심리 호재 분류 근거 수출 규제선 위에 있던 최상위 AI칩의 중국 출하 확인으로 엔비디아 데이터센터 매출 정상화 기대가 커지며 주가가 4% 상승했다 관련 종목·키워드 #엔비디아 #SK하이닉스 #한미반도체 #삼성전자 본 글은 원문 뉴스를 바탕으로 자동 요약·분석된 콘텐츠입니다. 원문 보기 (연합뉴스 증권) 원문 보기 📝 원데이트레이딩 편집 기준 작성 방식 공개 뉴스·공시를 기반으로 AI가 초안을 요약하고, 편집팀이 사실관계와 종목 연결을 검수합니다. 분석 기준 관련 종목·섹터·실적 영향·단기 주가 변수를 중심으로 투자자 관점에서 정리합니다. 데이터 출처 시세·외국인/기관 수급 데이터는 한국투자증권(KIS)에서 제공합니다. 투자 유의 본 콘텐츠는 투자 참고용이며, 특정 종목의 매매를 권유하지 않습니다. 정정·삭제 요청 devoh@signpost.kr 이 뉴스, 호재일까 악재일까? 한 번의 클릭으로 다른 투자자들과 판단을 비교해보세요. 📈 호재 📉 악재 🧩 관련 종목 기사 분석 기반 대장주·관련주 반도체 섹터 › 이 기사 대장주 엔비 ⭐ 엔비디아 NVDA 뉴스 → 관련 종목 SK SK하이닉스 한미 한미반도체 삼성 삼성전자 대장주·관련주는 기사 분석 및 시세 데이터 기반 자동 도출이며 투자 권유가 아닙니다. 관련 경제뉴스 미국 CPI 둔화에 증시 반전, 7월 금리인상 확률 10%p 급락한 진짜 이유 앤트로픽 장외 몸값 1조달러 넘었다, 지분 있어도 팔 사람이 없다 서학개미, 반도체주 하락에도 3배 레버리지 2.3조원 쓸어담아 변동성 경고 자초 메타 자체 AI칩 9월 양산돌입, 엔비디아 대신 브로드컴이 웃는 이유 뉴욕증시 3대 지수 반도체주가 이끌었다, 삼성전자·SK하이닉스가 볼 신호는 이거다 젠슨 황 가죽재킷, 소더비 경매 나온다…엔비디아 주가와는 무관한 이유 목록으로 경제뉴스 크립토뉴스 부동산뉴스 IT뉴스 모빌리티뉴스 바이오뉴스 산업뉴스 게임뉴스 엔터뉴스 인사이트 매거진 이용약관 개인정보처리방침 운영정책 청소년보호 투자 고지 | 공지사항 FAQ 문의 신고 | 서비스 소개 팀 소개 편집팀 편집정책 사업자등록번호: 753-18-02714 | 대표: 오한빈 | devoh@signpost.kr Tip © 2026 OneDayTrading. All rights reserved. 일부 콘텐츠는 CC BY-NC-SA 4.0 라이선스에 따라 이용할 수 있습니다. 본 사이트는 투자 권유나 특정 종목 추천을 목적으로 하지 않으며, 모든 투자 결정은 이용자 본인의 판단과 책임 하에 이루어져야 합니다. 게시된 정보의 정확성, 완전성, 적시성에 대해 보증하지 않으며, 이로 인해 발생한 손실에 대해 책임지지 않습니다. oneday . TRADING 홈 실시간 시세 경제 캘린더 배당 캘린더 공모주 일정 AI PRO 뉴스 경제 증시·환율·금리 크립토 비트코인·ETF 부동산 아파트·정책 IT AI·반도체·빅테크 모빌리티 전기차·배터리 바이오 임상·신약 산업 에너지·방산·조선 게임 신작·e스포츠 엔터 K팝·콘텐츠 인사이트 커뮤니티 매거진 시장 심리 최근 100 건 – /100 집계 중 호재 – 악재 – 데일리 인사이트 받아보기 매일 아침 시장을 여는 핵심 뉴스와 인사이트를 보내드립니다. 구독하기 ♥ 이 사이트가 도움이 됐다면 커피 한 잔으로 응원해 주세요 커피 한 잔 사주기 © 2026 OnedayTrading All rights reserved.",
                    "category":  "경제뉴스",
                    "market_label":  "증시·경제",
                    "source_name":  "",
                    "published_at":  "2026-07-14T23:02:21.829Z",
                    "og_image":  "https://onedaytrading.net/i/news/cards/6ec9bc8050c5ed9b.jpg"
                },
    "visual":  {
                   "strategy":  "manual_review",
                   "subject":  "",
                   "background_path":  "",
                   "source_url":  "https://onedaytrading.net/i/news/cards/6ec9bc8050c5ed9b.jpg",
                   "license":  "review_required"
               },
    "evidence":  [

                 ],
    "pages":  {
                  "page1":  {
                                "breaking_label":  "긴급속보",
                                "headline":  "엔비디아 H200 중국 출하 시작, 최상위 AI칩까지 넘은 수출 규제선",
                                "subtitle":  "엔비디아의 최상위 AI 반도체 H200이 미국 정부 고위 관계자의 의회 확인 속에 중국向 출하를 시작하며 주가가 장중 4% 급등했다. SK하이닉스의 HBM3e 공급과 국내 반도체 장비주까지 수급 기대감이 번지는 모습이다.",
                                "cta":  "핵심 분석 보기 →"
                            },
                  "page2":  {
                                "analysis_headline":  "이 뉴스가 시장에 중요한 이유는?",
                                "quick_answer":  "엔비디아의 최상위 AI 반도체 H200이 미국 정부 고위 관계자의 의회 확인 속에 중국向 출하를 시작하며 주가가 장중 4% 급등했다. SK하이닉스의 HBM3e 공급과 국내 반도체 장비주까지 수급 기대감이 번지는 모습이다.",
                                "paragraphs":  [
                                                   "엔비디아의 최상위 AI 반도체 H200이 미국 정부 고위 관계자의 의회 확인 속에 중국向 출하를 시작하며 주가가 장중 4% 급등했다. SK하이닉스의 HBM3e 공급과 국내 반도체 장비주까지 수급 기대감이 번지는 모습이다.",
                                                   "영향 경로와 미확인 변수는 추가 분석이 필요합니다.",
                                                   "후속 데이터가 확인되면 평가가 달라질 수 있습니다."
                                               ],
                                "memory_line":  "핵심 변수는 후속 데이터에서 확인됩니다."
                            },
                  "page3":  {
                                "evaluation":  "중립",
                                "evaluation_headline":  "현재 평가는\n\u0027중립\u0027",
                                "evaluation_summary":  "원문 사실은 확인됐지만 시장 영향은 추가 근거가 필요합니다.",
                                "expect":  "기사의 직접 효과",
                                "verify":  "공개되지 않은 조건",
                                "judge":  "후속 수치와 일정",
                                "paragraphs":  [
                                                   "확인된 사실을 중심으로 봅니다.",
                                                   "공개되지 않은 조건은 단정하지 않습니다.",
                                                   "후속 수치가 평가를 바꿀 기준입니다."
                                               ],
                                "memory_line":  "최종 판단은 후속 데이터가 말해줍니다."
                            },
                  "page4":  {
                                "instagram_handle":  "@onedaytrading.io",
                                "website":  "onedaytrading.net"
                            }
              },
    "qa":  {
               "approved":  false,
               "warnings":  [
                                "AI/편집 검수 필요",
                                "이미지 권리 검수 필요"
                            ]
           }
}
